[
  {
    "account_id": "0015b00001uWxzlAAC",
    "country": "France",
    "media_coverage_count_90d": 0,
    "founder_pedigree_source": "— [no data found post-acquisition]"
  },
  {
    "account_id": "001TQ00000PEoUsYAL",
    "country": "France",
    "media_coverage_count_90d": 0,
    "founder_pedigree_source": "— [no results]"
  },
  {
    "account_id": "001TQ000009hbIhYAI",
    "country": "France",
    "media_coverage_count_90d": 2,
    "senior_geo_hire": false,
    "founder_pedigree_source": "— [no data found — CEO Emmanuel Théry, CSO Sebastien Deschaux, no prior-exit info published]"
  }
]
